line_no,Single_ent,Multiple_ents,en,vi,tr,es,vi_translation,tr_translation,es_translation
1156,['margo'],,"I unrolled the carpet partway and immediately found something else: a flattened, empty box that had once contained twenty-four nutrition bars. I found myself able to imagine Margo here, leaning against the wall with musty rolled-up carpet for a seat, eating a nutrition bar. She is all alone, with only this to eat. Maybe she drives once a day to a convenience store to buy a sandwich and some Mountain Dew, but most of every day is spent here, on or near this carpet. This image seemed too sad to be true—it all struck me as so lonely and so very unMargo. But all the evidence of the past ten days accumulated toward a surprising conclusion: Margo herself was—at least part of the time—very unMargo.","Tôi trải tấm thảm được nửa chừng thì phát hiện ra còn có thứ khác nữa: một hộp rỗng, gấp phẳng, từng đựng hai mươi tư thanh dinh dưỡng tổng hợp. Tôi bắt đầu tưởng tượng được Margo đã ở đây, dựa lưng vào tường, trên tấm thảm ẩm mốc cuộn lại làm chỗ ngồi, ăn một thanh dinh dưỡng. Cô ấy hoàn toàn một mình, chỉ có thứ này để ăn. Có thể hàng ngày Margo vẫn lái xe đến cửa hàng tiện lợi mua bánh mì kẹp và vài chai Mountain Dew, nhưng hầu hết thời gian trong ngày là ở đây, ở trên hoặc gần tấm thảm. Hình dung đó dường như quá ảm đạm, khó có thể là thật được–tất cả đều dựng nên trong tâm trí tôi một Margo quá cô đơn và quá không-giống-Margo. Nhưng mọi bằng chứng từ mười ngày qua đều tụ đến một kết luận đáng ngạc nhiên: chính Margo–chí ít là cũng có lúc–rất không giống Margo.","Hakyı kısmen açtım ve anmda başka bir şey buldum: bir zamanlar yirmi dört tane gofret içeren düzleşmiş, boş bir kutu. Margo’yu burada, küflü halıyı koltuk olarak kullanıp duvara yaslanırken ve bir gofret yerken hayal edebiliyordum. Yapayalnız ve yiyecek olarak yalnızca bu gofretlerden var. Belki de günde bir defa bir sandviç ile birkaç Mountain Dew almak için bir markete gidiyor ama günlerinin çoğunu burada, bu halının üstünde ya da yanında geçiriyor. Bu hayal gerçek olamayacak kadar içler acısı görünüyordu... bütün bunların çok yalnız ve çok fazla naMargo olduğu dikkatimi çekti. Fakat son on günün bütün delilleri birikince şaşırtıcı bir sonuç ortaya çıkıyordu: Margo’nun kendisi bileen azından bazı zamanlarçok naMargo’ydu.","Desenrollé parte de la moqueta e inmediatamente encontré algo más: una caja chafada que en su momento había contenido veinticuatro barritas de cereales. Me descubrí a mí mismo imaginando a Margo allí, sentada en la moqueta enrollada y enmohecida, apoyada contra la pared y comiéndose una barrita de cereales. Está sola y no tiene otra cosa que comer. Quizá una vez al día va en coche a una tienda a comprarse un bocadillo y algún Mountain Dew, pero la mayor parte del día la pasa en esta moqueta o cerca de ella. Me pareció una imagen demasiado triste para ser real. Demasiado solitaria y nada propia de Margo. Pero los indicios de los últimos diez días parecían conducir a una sorprendente conclusión: Margo era —al menos buena parte del tiempo— muy poco propia de Margo.","I had spread the carpet halfway when I discovered something else: an empty, flat-folded box that had once contained twenty-four synthetic nutrition bars. I began to imagine Margo had been here, leaning against the wall, sitting on the musty rolled-up carpet, eating a nutrition bar. She was completely alone, with only this to eat. Maybe every day Margo still drove to the convenience store to buy sandwiches and a few bottles of Mountain Dew, but most of the time she was here, on or near the carpet. That image seemed too bleak to be true–it all conjured up in my mind a Margo who was too lonely and too unlike-Margo. But all the evidence from the past ten days pointed to a surprising conclusion: Margo–at least at times–was very unlike Margo.","I partially opened the drawer and found something else inside: a flattened, empty box that once contained twenty-four wafers. I could imagine Margo here, using the moldy carpet as a seat, leaning against the wall, and eating a wafer. Completely alone, with only these wafers as food. Maybe she goes to a market once a day to get a sandwich and a few Mountain Dews, but she spends most of her days here, on or beside this carpet. This vision seemed too pitiful to be real... it struck me that all of this was very lonely and very unMargo-like. But when all the evidence of the last ten days was accumulated, a surprising result emerged: even Margo herself was, at least sometimes, very unMargo-like.","I unrolled part of the carpet and immediately found something else: a crushed box that had once contained twenty-four cereal bars. I found myself imagining Margo there, sitting on the rolled-up and moldy carpet, leaning against the wall and eating a cereal bar. She is alone and has nothing else to eat. Maybe once a day she drives to a store to buy herself a sandwich and some Mountain Dew, but she spends most of the day on this carpet or near it. It seemed too sad an image to be real. Too lonely and not at all like Margo. But the clues from the last ten days seemed to lead to a surprising conclusion: Margo was —at least a good part of the time— very unlike Margo."
1159,['margo'],,And maybe this was what I needed to do above all. I needed to discover what Margo was like when she wasn’t being Margo.,Và có lẽ hơn hết đây chính là điều tôi cần làm. Tôi cần khám phá xem Margo ra sao khi cô ấy không phải là Margo.,"Ve belki de bu, her şeyden önce yapmam gereken şeydi. Margo’ nun, Margo olmazken neye benzediğini keşfetmem gerekiyordu.",Y quizá era lo que necesitaba más que nada. Necesitaba descubrir cómo era Margo cuando no estaba siendo Margo.,"And perhaps more than anything, this is what I need to do. I need to find out what Margo is like when she is not being Margo.",And maybe this was what I needed to do before anything else. I needed to discover what Margo looked like when she wasn't being Margo.,And maybe it was what I needed more than anything. I needed to discover what Margo was like when she wasn't being Margo.
1164,['whitman'],,"The thing is that the poem starts out really slowly—it’s just sort of a long introduction, but around the ninetieth line, Whitman finally starts to tell a bit of a story, and that’s where it picked up for me. So Whitman is sitting around (which he calls loafing) on the grass, and then:","Vấn đề ở chỗ bài thơ mở đầu cực kì chậm chạp–khúc vào đề kéo dài lê thê, tới đâu tận dòng thứ chín, rút cục Whitman mới chịu hé ra câu chuyện, và đó là chỗ tôi bắt đầu thấy vỡ vạc ra. Vậy là Whitman đang ngồi suông (mà ông gọi là an nhiên) trên cỏ, thì:","Mesele şu ki, şiir çok yavaş başlıyor... Bir tür uzun giriş bölümü var fakat doksanıncı dize civarında Whitman, sonunda birazcık da olsa hikâye anlatmaya başlıyor ve burası benim için şiirin hızlandığı yer. Sonuçta Whitman çimenlerin üstünde boş boş oturuyor (ki kendisi bunu aylaklık etmek olarak adlandırıyor) ve sonra:","El caso es que el poema empieza muy lento, con una especie de larga introducción, pero hacia el verso noventa Whitman empieza por fin a contar una historia, así que empecé por ahí. Whitman está sentado en la hierba (él dice tendido), y entonces:","The problem is that the poem starts extremely slowly—the introduction drags on and on, and it isn't until the ninth line that Whitman finally begins to reveal the story, and that's where I started to understand. So Whitman is sitting idly (which he calls being at ease) on the grass, then:","The thing is, the poem starts very slowly... There is a kind of long introduction, but around the ninetieth line, Whitman finally starts telling a bit of a story, and this is where the poem picks up pace for me. In the end, Whitman is sitting idly on the grass (which he calls loafing) and then:","The thing is that the poem starts very slowly, with a sort of long introduction, but around verse ninety Whitman finally begins to tell a story, so I started from there. Whitman is sitting on the grass (he says lying down), and then:"
1181,"['holden', 'dr holden']",,"So maybe the grass is a metaphor for our equality and our essential connectedness, as Dr. Holden had said. And then finally, he says of grass,","Vậy có lẽ cỏ là ẩn dụ cho sự bình đẳng và liên hệ mật thiết giữa chúng ta, như cô Holden đã nói. Và những lời cuối của Whitman về cỏ:","Yani belki de çimen bizim eşitliğimiz ve temeldeki bağlanmışlığımız için bir metafor, tıpkı dr Holden’m dediği gibi. Ve sonra sonunda, çimen için şöyle diyor:","Así que quizá la hierba es una metáfora de que somos iguales y estamos básicamente conectados, como me había dicho la doctora Holden. Y luego dice de la hierba:","So perhaps grass is a metaphor for equality and the close connection between us, as Ms. Holden mentioned. And Whitman's final words about grass:","So maybe grass is a metaphor for our equality and fundamental interconnectedness, just as Dr. Holden said. And then finally, he says this about the grass:","So maybe the grass is a metaphor that we are equal and basically connected, as Dr. Holden had told me. And then it says about the grass:"
1192,['margo'],,"But I could also imagine this: Margo picking these books up at various garage sales, buying every travel guide she could get her hands on for a quarter or less. And then coming here—even before she disappeared—to read the books away from prying eyes. Reading them, trying to decide on destinations. Yes. She would stay on the road and in hiding, a balloon floating through the sky, eating up hundreds of miles a day with the help of a perpetual tailwind. And in this imagining, she was alive. Had she brought me here to give me the clues to piece together an itinerary? Maybe. Of course I was nowhere near an itinerary. Judging from the books, she could be in Jamaica or Namibia, Topeka or Beijing. But I had only just begun to look.","Nhưng tôi cũng tưởng tượng thế này nữa: Margo nhặt nhạnh những sách này từ nhiều đợt bán hàng thanh lí, mua bất cứ cuốn hướng dẫn du lịch nào với giá dưới hai mươi lăm xu mà cô ấy tìm được. Rồi Margo đến đây–trước cả khi cô ấy biến mất–đọc sách và tránh xa những cặp mắt tò mò. Đọc hết, cố gắng vạch ra hành trình. Đúng vậy. Cô ấy sẽ rong ruổi và không để lại dấu vết, một quả bóng bay phiêu du trên bầu trời, thuận chiều ngọn gió miên viễn, mỗi ngày bỏ lại đằng sau hàng trăm dặm đường. Và trong tưởng tượng này của tôi, Margo đầy sức sống. Có phải Margo dẫn tôi đến đây để trao cho tôi những manh mối ghép lại với nhau thành một hành trình hay không? Có thể. Tất nhiên tới giờ tôi vẫn chưa mon men tới gần được hành trình ấy. Dựa theo những cuốn sách, Margo có thể đang ở Jamaica hoặc Namibia, Topeka hoặc Bắc Kinh. Nhưng tôi chỉ mới bắt đầu tìm kiếm thôi mà.","Ama şunu da hayal edebiliyordum: Margo’nun çeşitli indirimli satışlardan bu kitapları rastgele bulduğunu ve eline geçirdiği tüm seyahat rehberlerini bir çeyrekliğe ya da daha azma satın aldığını. Sonra bu kitapları meraklı gözlerden uzakta okumak içinortadan kaybolmasından bile önceburaya geldiğini. Gideceği yerlere karar vermeye çalışarak onları okuduğunu. Evet. Saklanarak yol alacaktı; ardından esen bir rüzgâr yardımıyla bir günde yüzlerce kilometre kateden, gökyüzünde süzülen bir balon. Ve bu hayalde Margo hayattaydı. Beni buraya bir güzergâhın parçalarını birleştirmem için gereken ipuçlarını vermek için mi getirmişti? Belki. Elbette bir güzergâhın yakınında bile değildim. Kitaplardan anlaşıldığı kadarıyla Jamaika, Namibya, Topeka ya da Pekin’de olabilirdi. Fakat bakmaya daha yeni başlamıştım.","Pero también podía imaginarme lo siguiente: Margo comprando esos libros en diversos mercadillos, comprando todas las guías de viajes que caían en sus manos a precio de saldo. Luego yendo allí —incluso antes de que desapareciera— para leerlas alejada de miradas indiscretas. Leyéndolas e intentando decidir adónde dirigirse. Sí. Viajaría y se escondería, un globo volando por el cielo, haciendo cientos de kilómetros al día con la ayuda de un perpetuo viento de cola. Y la imaginaba viva. ¿Me había llevado hasta allí para darme las pistas para que descifrara el itinerario? Quizá. Por supuesto, yo estaba bien lejos de haber descifrado el itinerario. A juzgar por los libros, podía estar en Jamaica, Namibia, Topeka o Pekín. Pero no había hecho más que empezar a mirar.","But I also imagine this: Margo collected these books from various clearance sales, buying any travel guide she could find for under twenty-five cents. Then Margo came here—even before she disappeared—reading books and staying away from prying eyes. Read them all, trying to map out a journey. Exactly. She would wander without leaving a trace, a balloon drifting in the sky, following the eternal wind, leaving behind hundreds of miles each day. And in this imagination of mine, Margo is full of life. Did Margo lead me here to give me clues to piece together into a journey? Maybe. Of course, so far I haven't even come close to that journey. Based on the books, Margo could be in Jamaica or Namibia, Topeka or Beijing. But I have only just started searching.","But I could also imagine this: that Margo had randomly found these books from various discount sales and bought all the travel guides she could get her hands on for a quarter or less. Then, even before she disappeared to read these books away from prying eyes, she had come here. Reading them while trying to decide where to go. Yes. She would travel in hiding; then, with the help of a gust of wind, she would cover hundreds of kilometers in a day, floating in the sky like a balloon. And in this dream, Margo was alive. Had she brought me here to give me the clues I needed to piece together a route? Maybe. Of course, I wasn't even close to a route. From what I could gather from the books, she could be in Jamaica, Namibia, Topeka, or Beijing. But I had just started looking.","But I could also imagine the following: Margo buying those books at various flea markets, buying all the travel guides that fell into her hands at bargain prices. Then going there—even before she disappeared—to read them away from prying eyes. Reading them and trying to decide where to go. Yes. She would travel and hide, a balloon flying through the sky, covering hundreds of kilometers a day with the help of a perpetual tailwind. And I imagined her alive. Had she brought me there to give me the clues to decipher the itinerary? Maybe. Of course, I was far from having deciphered the itinerary. Judging by the books, she could be in Jamaica, Namibia, Topeka, or Beijing. But I had only just begun to look."
1210,['margo'],,"I took a long breath. If Margo were going to show up, she would have showed up by three. “I’ll be there in half an hour.”","Tôi hít một hơi thật sâu. Nếu Margo quay lại nơi này, hẳn là cô ấy đã đến trước ba giờ sáng. “Nửa tiếng nữa tôi qua.”","Derin bir nefes aldım. Eğer Margo ortaya çıkacak olsaydı, üçe kadar ortaya çıkardı. “Yarım saate orada olacağım!","Respiré hondo. Si Margo hubiera querido aparecer, habría aparecido antes de las tres. —Estaré allí dentro de media hora.","I took a deep breath. If Margo came back to this place, she must have arrived before three in the morning. ""I'll be there in half an hour.""","I took a deep breath. If Margo were going to show up, she would have appeared by the count of three. ""I'll be there in half an hour!""","I took a deep breath. If Margo had wanted to show up, she would have shown up before three. —I will be there in half an hour."
1222,['angela'],,"“They’re both his,” Angela explained to me calmly.","“Của cậu ấy cả đấy,” Angela bình tĩnh giải thích cho tôi.","“İkisi de onun,” diye açıkladı Angela sakin bir şekilde.",—Los dos son suyos —me explicó Angela con un tono tranquilo.,"“It's all his,” Angela calmly explained to me.","“Both of them are his,” Angela explained calmly.",—Both of them are his —Angela explained to me in a calm tone.
1252,"['¿lacey', 'lacey']",,"And I said, “Uh, Lacey?”","Tôi liền đáp, “Tớ, Lacey đấy à","“Ah, Lacey?” dedim.",—¿Quién está ahí? —¿Lacey? —pregunté.,"I immediately replied, ""It's me, Lacey?""","""Ah, Lacey?"" I said.",—Who is there? —Lacey? —I asked.
1263,['becca'],,"“I’m sorry,” I said. “The thing is that Becca is just jealous.”","“Tớ rất tiếc chuyện đã xảy ra như vậy,” tôi nói. “Vấn đề là Becca ghen tị thôi mà.”","“Üzgünüm,” dedim. “Olay şu ki, Becca sadece kıskanıyor.",—Lo siento —le dije—. El problema es que Becca está celosa.,"“I'm very sorry that it happened like that,” I said. “The problem is that Becca is just jealous.”","“I'm sorry,” I said. “The thing is, Becca is just jealous.”",—I'm sorry —I told her—. The problem is that Becca is jealous.
1266,['lacey'],,Lacey shrugged bashfully. “Do you think I’m superficial?”,"Lacey bẽn lẽn nhún vai, “Cậu có nghĩ tớ phù phiếm nông cạn không?”",Lacey çekinerek omuzlarını silkti. “Sence yüzeysel miyim?,Lacey se encogió de hombros tímidamente. —¿Crees que soy superficial?,"Lacey shyly shrugged, ""Do you think I'm frivolous and shallow?""","Lacey hesitantly shrugged her shoulders. ""Do you think I'm superficial?""",Lacey shrugged timidly. —Do you think I'm superficial?
1274,['lacey'],,"Lacey was quiet for a while, breathing through her open mouth. When she finally said it, she almost whispered it. Worded like a question and spoken like a statement: “She’s dead, isn’t she.”","Lacey yên lặng một lúc, há miệng ra thở. Rút cục khi lên tiếng, cậu ấy gần như thì thầm. Tìm từ cho một câu hỏi và nói ra như một khẳng định, “Margo chết rồi, phải không.”","Lacey, açık ağzmdan nefes alarak bir süre sessiz kaldı. Sonunda konuştuğunda neredeyse fısıldıyordu. Bir soru gibi kelimelere dökülmüş, bir açıklama olarak dile getirilmiş bir cümle: “O öldü, değil mi.","Lacey se quedó un momento callada, respirando por la boca. Cuando por fin lo dijo, fue casi en un susurro. Parecía una pregunta, aunque lo pronunció como una afirmación: —Está muerta, verdad.","Lacey was silent for a moment, mouth open, breathing. Finally, when she spoke, it was almost a whisper. Finding the words for a question and stating it as a fact, “Margo is dead, isn't she.”","Lacey remained silent for a while, breathing through her open mouth. When she finally spoke, she was almost whispering. Her words sounded like a question a sentence uttered as an explanation: ""He died, didn't he.""","Lacey stayed silent for a moment, breathing through her mouth. When she finally spoke, it was almost in a whisper. It seemed like a question, though she pronounced it as a statement: —She is dead, right."
1284,['ben'],,"Just as I was about to ask the guys by the keg if they’d seen Ben, he ran into the living room. He wore a blue baby bonnet on his head and was wielding a sword made out of eight empty cans of Milwaukee’s Best Light, which had, I assumed, been glued together.","Tôi đang định hỏi mấy cậu tụ tập quanh bom bia xem có thấy Ben đâu không, thì Ben đã chạy sầm sầm vào phòng khách. Nó đội cái mũ nồi trẻ con màu xanh da trời trên đầu, tay lăm lăm thanh gươm chế từ tám lon bia Milwaukee’s Best Light rỗng. Xem chừng Ben đã lấy keo dính tất cả lại.","Tam fıçının yanındaki çocuklara Ben’i görüp görmediklerini sormak üzereydim ki Ben koşarak salona girdi. Kafasına açık mavi renkli bir bone takmıştı ve elinde, birbirine yapıştırıldığım düşündüğüm, sekiz tane boş Milwaukee’s Best Light8 kutusundan oluşturulmuş bir kılıç tutuyordu.","Estaba a punto de preguntar a los tipos que había junto al barril si habían visto a Ben cuando entró corriendo en la sala. Llevaba en la cabeza un gorro azul de bebé y blandía una espada hecha con ocho latas vacías de Milwaukee’s Best Light, que supuse que había pegado.","I was about to ask the guys gathered around the beer keg if they had seen Ben, when Ben came charging into the living room. He was wearing a sky-blue child's beret on his head, holding a sword made from eight empty cans of Milwaukee’s Best Light. It looked like Ben had glued them all together.","I was about to ask the children next to the barrel if they had seen Ben when Ben ran into the room. He was wearing a light blue cap on his head and holding a sword made of eight empty Milwaukee’s Best Light8 cans, which I thought were glued together.","I was about to ask the guys by the barrel if they had seen Ben when he ran into the room. He was wearing a blue baby hat on his head and wielding a sword made of eight empty cans of Milwaukee’s Best Light, which I assumed he had glued together."
1309,['lacey'],,"“Good thinking,” Lacey deadpanned.","“Tư duy sắc bén đấy,” Lacey cố tỏ ra nghiêm túc.","“İyi düşünmüşsün,” dedi Lacey duygusuz bir ifadeyle.","—Bien pensado —dijo Lacey, impávida.","“Sharp thinking,” Lacey tried to appear serious.","“You’ve thought it through,” said Lacey with an emotionless expression.","—Well thought out —said Lacey, impassively."
1367,"['angela', 'how']",,"“So,” I said after hanging up. “How’s Angela?”","“Vậy,” tôi nói sau khi ngắt điện thoại, “chuyện Angela thế nào rồi?”","“Peki,” dedim telefonu kapattıktan sonra. “Angela nasıl?","—Bueno —dije después de colgar—, ¿qué tal Angela?","“So,” I said after hanging up the phone, “how is Angela doing?”","“Okay,” I said after hanging up the phone. “How is Angela?""","—Well —I said after hanging up—, how's Angela?"
1418,"['new york', 'lacey']",,"“I’m still for New York,” Lacey said.","“Tớ vẫn ủng hộ giả thuyết New York,” Lacey nói.","“Ben hâlâ New York diyorum,” dedi Lacey.",—Yo sigo apostando por Nueva York —dijo Lacey.,"""I still support the New York hypothesis,"" Lacey said.","“I still say New York,” said Lacey.",—I still bet on New York —said Lacey.
1436,['gus'],,We pulled around some rolling desk chairs and sat in an approximate circle. “Did you guys break the particleboard?” Gus asked.,"Chúng tôi kéo mấy cái ghế xoay lại, ngồi thành vòng gần tròn quay mặt vào nhau. “Mấy đứa nện thủng ván gỗ ngoài kia phải không?” Gus hỏi.",Etraftan birkaç tane döner sandalye çektik ve çember oluşturacak şekilde oturduk. “Sunta levhayı siz mi kırdınız?” diye sordu Gus.,Cogimos sillas de oficina con ruedas y nos sentamos formando más o menos un círculo. —¿Fuisteis vosotros los que rompisteis el tablón? —preguntó Gus.,"We pulled a few swivel chairs together, sitting in a near circle facing each other. ""Were you the ones who punched through the wooden boards out there?"" Gus asked.",We pulled a few swivel chairs from around and sat in a circle. “Did you break the chipboard?” Gus asked.,We took office chairs with wheels and sat down forming more or less a circle. —Was it you who broke the plank? —asked Gus.
1441,['lacey'],,“Was?” asked Lacey pointedly.,“Sao lại là ‘đã’?” Lacey tinh ý.,“di?” diye sordu Lacey manalı bir şekilde.,—¿Estaba? —preguntó Lacey con énfasis.,“Why 'already'?” Lacey asked perceptively.,“What?” Lacey asked meaningfully.,—asked Lacey with emphasis.
1452,"['gus', 'gus—']",,"“Honestly,” Gus said, “she never really got what it’s all about. The adventure. She seemed pretty depressed, actually.”","“Thật ra,” Gus nói, “Margo chưa bao giờ thực sự tham gia vào trò vui cả. Tất cả những phiêu lưu đó. Mà thực tế con bé có vẻ rầu rĩ lắm.”","“Doğrusu,” dedi Gus, “bütün bunların gerçekte neyle ilgili olduğunu hiç anlamadı. Macera. Depresyonda gibi görünüyordu aslında.","—Sinceramente, nunca entendió de qué iba el tema —dijo Gus—. La aventura. En realidad, parecía bastante deprimida.","“Actually,” Gus said, “Margo never really participated in the fun. All those adventures. In fact, she seemed quite gloomy.”","“Honestly,” said Gus, “he never really understood what all this was about. Adventure. He actually seemed to be depressed.”","—Honestly, she never understood what it was about —said Gus—. The adventure. In reality, she seemed quite depressed."
