line_no,Single_ent,Multiple_ents,en,vi,tr,es,vi_translation,tr_translation,es_translation
847,['lacey'],,"Lacey nodded. “Well, but we don’t want to be too matchy-matchy. Maybe if you go traditional: black tux and a black vest?”","Lacey gật đầu. “Tốt thôi, nhưng chúng ta không nên quá đôi lứa xứng đôi. Có lẽ cậu cứ theo truyền thống đi: lễ phục màu đen nhé?”",Lacey başını salladı. “Peki ama fazla uygun olmak istemeyiz. Belki sen geleneksel takılırsın: Siyah smokin ile siyah yelek?,"Lacey asintió. —Bueno, pero tampoco vayamos demasiado conjuntados. Podrías ir tradicional, con esmoquin negro y chaleco negro.","Lacey nodded. “Alright, but we shouldn't be too much of a perfect match. Maybe you should just stick to tradition: a black suit?”","Lacey nodded. “Okay, but we don't want to be too conventional. Maybe you can go traditional: Black tuxedo with a black vest?”","Lacey nodded. —Well, but let's not go too coordinated either. You could go traditional, with a black tuxedo and a black vest."
893,"['margo', 'marg']",,"So what he did was he took a pencil and one of those steel compass things, and he started drawing circles onto a piece of paper. All the circles exactly two inches in diameter. And he would draw the circles until the entire piece of paper was completely black, and then he would get another piece of paper and draw more circles, and he did this every day, all day, and didn’t pay attention in school and drew circles all over all of his tests and shit, and my mom said that this kid’s problem was that he had created a routine to cope with his loss, only the routine became destructive. So anyway, then my mom made him cry about his dad or whatever and the kid stopped drawing circles and presumably lived happily ever after. But I think about the circles kid sometimes, because I can sort of understand him. I always liked routine. I suppose I never found boredom very boring. I doubted I could explain it to someone like Margo, but drawing circles through life struck me as a kind of reasonable insanity.","Và thằng bé đã làm thế này, nó lấy cái bút chì và một trong những thứ như com-pa sắt, bắt đầu vẽ những vòng tròn lên giấy. Tất cả các vòng tròn đều có bán kính chính xác năm phân. Thằng bé cứ vẽ mãi những vòng tròn cho đến khi tờ giấy đen kịt, nó sẽ lấy một tờ khác và vẽ tiếp những vòng tròn. Ngày nào nó cũng làm thế, suốt ngày, chẳng chú ý đến học hành, vẽ cả vòng tròn lên kín các bài kiểm tra và bài vở ở trường. Mẹ tôi bảo vấn đề của thằng bé là ở chỗ nó đã tạo ra một thói quen đều đặn để đương đầu với mất mát, chỉ có điều chính thói quen ấy lại hủy hoại nó. Thế là khi mẹ tôi tìm cách khiến thằng bé bật khóc vì người cha đã mất, nó thôi không vẽ vòng tròn nữa, và được cho là từ đó sẽ sống hạnh phúc mãi mãi. Nhưng thỉnh thoảng tôi lại nghĩ đến thằng bé vẽ vòng tròn ấy, vì hình như tôi hiểu được nó. Tôi luôn thích những thói quen đều đặn. Tôi còn nghĩ chắc tôi không bao giờ thấy sự nhàm chán có gì đáng chán lắm. Có lẽ tôi không giải thích nổi điều này cho ai đó như Margo, nhưng vẽ những vòng tròn đi hết đời mình mang lại cho tôi chút cảm giác điên rồ có nghĩa lí.","Sonuçta şöyle bir şey yapmış: Bir kalem ile şu çelik pergellerden almış ve bir kâğıdın üzerine çemberler çizmeye başlamış. Bütün çemberler tam olarak iki santimetre çapındaymış. Çemberleri, kâğıdın tamamı siyah olana kadar çiziyor, sonra başka bir kâğıt alıp daha fazla çember çiziyormuş ve bunu her gün sürekli yapıyormuş. Derslere dikkatini vermeyip sınav kâğıtlarının filan her yerine çember çiziyormuş ve annem çocuğun sorununun, kaybıyla başa çıkmak için yarattığı rutinin yıkıcı hale gelmesi olduğunu söylemişti. Yani her neyse, sonra annem babası için falan ağlamasını sağlamış ve çocuk çember çizmeyi bırakıp galiba sonsuza kadar mutlu yaşamış. Ama bazen çember çocuğu düşünürüm çünkü onu bir nevi anlıyorum. Her zaman rutini sevdim. Sanırım hiçbir zaman can sıkıntısını sıkıcı bulmadım. Margo gibi birine bunu açıklayabileceğimden emin değildim ama hayatta çemberler çizmek bende makul bir tür delilik izlenimi bırakıyordu.","Lo que hizo el niño fue coger un lápiz y un compás, y empezar a dibujar circunferencias en una hoja de papel. Todas las circunferencias de exactamente cinco centímetros de diámetro. Y dibujaba circunferencias hasta que toda la hoja de papel quedaba totalmente negra. Entonces cogía otra hoja y dibujaba más circunferencias. Y lo hacía todos los días, a todas horas. No prestaba atención en clase, dibujaba circunferencias en todos los exámenes, y mi madre me dijo que el problema del niño era que había generado una rutina para sobrellevar su pérdida, pero que la rutina se había vuelto destructiva. El caso es que mi madre consiguió que llorara por su padre, y el niño dejó de dibujar circunferencias y al parecer desde entonces vivió feliz. Pero de vez en cuando pienso en el niño de las circunferencias, porque de alguna manera lo entiendo. Siempre me han gustado las rutinas. Supongo que aburrirme nunca me había aburrido demasiado. Suponía que no podría explicárselo a alguien como Margo, pero pasarte la vida dibujando circunferencias me parecía una locura hasta cierto punto razonable.","And the boy did this, he took a pencil and one of those things like a metal compass, and started drawing circles on paper. All the circles had an exact radius of five centimeters. The boy kept drawing circles until the paper was completely black, then he would take another sheet and continue drawing circles. He did this every day, all day long, not paying attention to his studies, drawing circles all over his tests and schoolwork. My mother said the boy's problem was that he had created a regular habit to cope with loss, but it was this very habit that was destroying him. So when my mother tried to make the boy cry for his lost father, he stopped drawing circles, and was said to live happily ever after from then on. But sometimes I think about that boy drawing circles, because it seems like I understand him. I've always liked regular habits. I even think that I never found boredom to be all that boring. Maybe I can't explain this to someone like Margo, but drawing circles for the rest of my life gives me a bit of a crazy sense of meaning.","In the end, he did something like this: He took one of those steel compasses with a pencil and started drawing circles on a piece of paper. All the circles were exactly two centimeters in diameter. He would draw circles until the entire paper was black, then take another paper and draw more circles, and he did this continuously every day. He wasn't paying attention in classes and was drawing circles all over his exam papers and such, and my mom said that the child's problem was that the routine he created to cope with his loss had become destructive. So anyway, then my mom made him cry for his father or something, and the kid stopped drawing circles and apparently lived happily ever after. But sometimes I think about the circle kid because I kind of understand him. I've always liked routine. I guess I've never found boredom boring. I wasn't sure if I could explain this to someone like Margo, but in life, drawing circles left me with the impression of a reasonable kind of madness.","What the boy did was take a pencil and a compass, and start drawing circles on a sheet of paper. All the circles were exactly five centimeters in diameter. And he drew circles until the entire sheet of paper was completely black. Then he would take another sheet and draw more circles. And he did this every day, all the time. He didn't pay attention in class, he drew circles on all the exams, and my mother told me that the boy's problem was that he had created a routine to cope with his loss, but the routine had become destructive. The fact is that my mother managed to make him cry for his father, and the boy stopped drawing circles and apparently lived happily ever since. But every now and then I think about the boy with the circles, because in some way I understand him. I've always liked routines. I suppose that being bored never really bored me too much. I figured I couldn't explain it to someone like Margo, but spending your life drawing circles seemed like a somewhat reasonable madness to me."
921,['margo'],,"“No, thanks,” I said, and breezed past them through the kitchen and into the garage. I found the widest flathead screwdriver and then stuck it in the waistband of my khaki shorts, cinching my belt tight. I grabbed a cookie out of the kitchen and then walked back through the living room, my gait only slightly awkward, and while they watched the televised mystery unfold, I removed the three pins from my bedroom door. When the last one came off, the door creaked and started to fall, so I swung it all the way open against the wall with one hand, and as I swung it, I saw a tiny piece of paper—about the size of my thumbnail—flutter down from the door’s top hinge. Typical Margo. Why hide something in her own room when she could hide it in mine? I wondered when she’d done it, how she’d gotten in. I couldn’t help but smile.","“Không ạ,” tôi đáp, chạy ù từ phòng khách qua bếp, vào ga-ra. Tôi tìm được cái tua-vít đầu bẹt to nhất, giắt nó vào cạp quần soóc ka-ki, kéo thắt lưng cho chặt. Tôi vớ đại một cái bánh qui trong bếp rồi ngược qua phòng khách về phòng mình, bước đi hơi có chút kì kì gượng gạo. Trong khi bố mẹ chăm chú theo dõi bí mật vụ án trên ti-vi được bật mí, tôi lặng lẽ tháo ba cái đinh khỏi bản lề cửa phòng mình. Khi cái cuối cùng trật ra, cánh cửa kêu “rắc” một tiếng và lỏng ra. Tôi đẩy tới đẩy lui cánh cửa quanh gờ tường bằng một tay, và khi đẩy như vậy, tôi thấy một mẩu giấy nhỏ xíu–cỡ móng tay cái của tôi–rơi từ bản lề trên cùng xuống. Đúng kiểu Margo rồi nhé. Tại sao phải giấu thứ gì đó trong phòng cô ấy trong khi cô ấy có thể giấu ngay trong phòng tôi? Không biết cô ấy đã hành động lúc nào, làm thế nào lại vào được nhỉ. Tôi không thể nhịn được mỉm cười.","“Hayır, sağ ol,” dedim ve onları geçip mutfaktan garaja rüzgâr gibi geçtim. En geniş düz uçlu tornavidayı buldum, sonra onu hâki şortumun kemerine sokup kemerimi sıktım. Mutfaktan bir kurabiye aldım, tekrar salondan geçtim, yürüyüş şeklim hafiften tuhaf görünüyor olmalıydı ve onlar televizyondaki gizemin çözümlenme sini izlerlerken, ben odamın kapısından üç menteşeyi çıkardım. Sonuncusu çıkınca kapı gıcırdadı ve düşmeye başladı, bu yüzden bir elimle duvara yaslayıp tamamen açtım, kapıyı iterken ufacık bir kâğıt parçasınınyaklaşık olarak başparmağımın tırnağı boyutundaydıkapının üst menteşesinden aşağı doğru uçtuğunu gördüm. Her zamanki Margo işte. Benimkine saklayabilecekken neden kendi odasına bir şey saklayacaktı ki? Bunu ne zaman yaptığını merak ediyordum... nasıl içeri girdiğini. Gülümsemekten kendimi alamadım.","—No, gracias —le contesté. Crucé la cocina y entré en el garaje. Busqué el destornillador plano más grande que teníamos, me lo metí en la cintura de los pantalones cortos caquis y me apreté bien el cinturón. Cogí una galleta de la cocina, volví a cruzar el salón con pasos solo ligeramente torpes y, mientras veían en la tele cómo se resolvía el misterio, quité los tres clavos de la puerta de mi habitación. Cuando salió el último, la puerta crujió y empezó a inclinarse, así que con una mano la empujé contra la pared, y mientras la colocaba, vi que de la bisagra de arriba salía volando un trocito de papel del tamaño de la uña de mi pulgar. Típico de Margo. ¿Para qué esconder algo en su habitación si podía esconderlo en la mía? Me pregunté cuándo lo había hecho, cómo se había metido en mi habitación. No pude evitar sonreír.","""No,"" I replied, running from the living room through the kitchen, into the garage. I found the largest flathead screwdriver, tucked it into the waistband of my khaki shorts, and tightened my belt. I grabbed a cookie from the kitchen and then went back through the living room to my room, walking a bit awkwardly. While my parents were engrossed in the TV show revealing the mystery of the case, I quietly removed the three screws from the hinge of my room door. When the last one came out, the door made a ""crack"" sound and loosened. I pushed and pulled the door around the edge of the wall with one hand, and as I did so, I saw a tiny piece of paper—about the size of my thumbnail—fall from the top hinge. Classic Margo. Why hide something in her own room when she could hide it in mine? I wondered when she had done it, and how she had gotten in. I couldn't help but smile.","“No, thanks,” I said and breezed past them from the kitchen to the garage. I found the largest flathead screwdriver, then tucked it into the belt of my khaki shorts and tightened my belt. I grabbed a cookie from the kitchen, passed through the living room again, my walking style must have looked slightly odd, and they were engrossed in the unraveling mystery on the television. While they were following the tracks, I removed three hinges from my room's door. When the last one came out, the door creaked and started to fall, so I leaned it against the wall with one hand and fully opened it. As I pushed the door, I saw a tiny piece of paper, roughly the size of my thumbnail, fluttering down from the top hinge of the door. Typical Margo. Why would she hide something in her own room when she could have hidden it in mine? I wondered when she did this... how she got inside. I couldn't help but smile.","—No, thank you —I replied. I crossed the kitchen and entered the garage. I looked for the largest flathead screwdriver we had, tucked it into the waistband of my khaki shorts, and tightened my belt. I grabbed a cookie from the kitchen, crossed the living room again with only slightly clumsy steps, and while they watched on TV how the mystery was solved, I removed the three nails from my bedroom door. When the last one came out, the door creaked and started to tilt, so with one hand I pushed it against the wall, and while positioning it, I saw a tiny piece of paper the size of my thumbnail fly out from the top hinge. Typical of Margo. Why hide something in her room if she could hide it in mine? I wondered when she had done it, how she had gotten into my room. I couldn't help but smile."
963,['margo'],,"I took a long breath. The excitement of being somewhere other than school had started to wane. This didn’t seem like a place where Margo would hide, or even visit. It was a far cry from New York City. This was the Florida you fly over, wondering why people ever thought to inhabit this peninsula. I stared at the empty asphalt, the heat distorting my vision. Ahead, I saw a strip mall wavering in the bright distance.","Tôi hít một hơi thật sâu. Cơn hứng khởi trốn học đi chơi đã xẹp dần. Nơi này chẳng có vẻ gì là chỗ Margo sẽ trú ẩn, hoặc thậm chí ghé qua. Khác một trời một vực thành phố New York. Đây là phần Florida mà người ta chỉ bay qua, tự hỏi sao có thể tá túc ở mảnh bán đảo này. Tôi chăm chăm nhìn mặt đường nhựa trống trơn, cái nóng như kéo nhòe thị giác. Phía trước, một vệt cửa hàng trông như khu mua sắm dập dờn trong ánh nắng xa xa.","Derin bir nefes aldım. Okuldan başka bir yerde olmanın heyecanı azalmaya başlamıştı. Burası Margo’nun saklanacağı ya da ziyaret edeceği bir yer gibi görünmüyordu. New York’tan bambaşka bir yerdi. Bu, insanlarm bu yarımadaya neden yerleşmeyi düşündüklerini merak ederek üstünden uçup gittiği Florida’ydı işte. Boş asfalta baktım, sıcaklık görüşümü bozuyordu. İleride, parlak alanda titreyen fabrika satış mağazası tipinde bir alışveriş merkezi gördüm.","Respiré hondo. La emoción de no estar en el instituto había empezado a disminuir. No parecía un sitio en el que Margo se escondería, ni siquiera al que querría ir. Nada que ver con Nueva York. Era la Florida que ves desde un avión y te preguntas por qué a alguien se le ocurrió un día poblar esta península. Miré el asfalto vacío. El calor me distorsionaba la visión. Frente a nosotros vi un pequeño centro comercial temblando en la distancia.","I took a deep breath. The excitement of skipping school to go out had gradually faded. This place didn't seem like somewhere Margo would hide, or even visit. A world apart from New York City. This is the part of Florida that people just fly over, wondering how anyone could live on this peninsula. I stared at the empty asphalt road, the heat blurring my vision. Ahead, a strip of stores looked like a wavering shopping area in the distant sunlight.","I took a deep breath. The excitement of being somewhere other than school had started to wane. This place didn’t look like somewhere Margo would hide or visit. It was a place completely different from New York. This was Florida, the place people flew over, wondering why anyone would think of settling on this peninsula. I looked at the empty asphalt, the heat was distorting my vision. In the distance, I saw a shopping center shimmering in the bright area, resembling a factory outlet store.","I took a deep breath. The excitement of not being at school had started to wane. It didn't seem like a place where Margo would hide, or even want to go. Nothing like New York. It was the Florida you see from a plane and wonder why anyone ever thought to populate this peninsula. I looked at the empty asphalt. The heat distorted my vision. In front of us, I saw a small shopping center shimmering in the distance."
981,"['margo', 'whitman']",,"But even so, I cannot picture her here alive. It occurs to me that the Whitman could be a suicide note. I think about things she highlighted: “To die is different from what any one supposed, and luckier.” “I bequeath myself to the dirt to grow from the grass I love, / If you want me again look for me under your bootsoles.” For a moment, I feel a flash of hope when I think about the last line of the poem: “I stop some where waiting for you.” But then I think that the I does not need to be a person. The I can also be a body.","Dẫu vậy, tôi vẫn không thể hình dung Margo còn sống ở đây. Tôi chợt nhận ra rằng những câu thơ của Whitman có thể là lời nhắn tuyệt mệnh. Tôi nghĩ đến những dòng cô ấy đã đánh dấu: “Và chết chẳng giống những gì người ta huyễn tưởng, và thêm phước phận. “Ta trả mình về đất, nuôi những thân cỏ ta yêu, / Nếu ngươi muốn ta, hãy tìm ta dưới đế ủng.” Trong tích tắc, tôi thấy lóe lên chút hi vọng khi nghĩ đến câu cuối bài thơ: “Ở đâu đó, ta dừng lại đợi ngươi.” Nhưng rồi tôi nghĩ ta không nhất thiết phải là một con người. Ta cũng có thể là một cái xác.","Ama her şeye rağmen, burada Margo’yu canlı olarak hayal edemiyorum. Whitman’ın bir intihar mektubu olabileceği aklıma geliyor. Altını çizdiği şeyleri düşünüyorum: “Ölmek herkesin varsaydığından daha farklı ve talihli.” “Toprağa, sevdiğim çimenle büyümeye bırakıyorum kendimi, / Eğer tekrar istiyorsan, tabanlarının altında ara beni.” Şiirin son dizesini düşününce, bir anlığına bir umut dalgası hissediyorum: “Ben bir yerde duruyorum bekleyerek seni.” Ama sonra ben kelimesinin bir insan olması gerekmediğini düşünüyorum. Ben, bir ceset de olabilir.","Pero, aun así, no me la puedo imaginar viva aquí. Se me ocurre que el Whitman podría ser una nota de suicidio. Pienso en versos que había marcado: «Y morir es algo distinto de lo que muchos supusieron, y de mejor augurio». «Que el lodo sea mi heredero, quiero crecer del pasto que amo; / Si quieres encontrarte conmigo, búscame bajo la suela de tus zapatos». Por un momento siento un destello de esperanza al pensar en el último verso del poema: «En alguna parte te espero». Pero luego pienso que esa primera persona no tiene por qué ser una persona. También puede ser un cuerpo.","Even so, I still can't imagine Margo living here. I suddenly realized that Whitman's verses might be a suicide note. I thought of the lines she had marked: ""And death is not what people imagine, and it is a blessing."" “I return myself to the earth, nurturing the grasses I love, / If you want me, look for me under the soles of your boots.” In an instant, I saw a glimmer of hope when thinking about the last line of the poem: “Somewhere, I stop and wait for you.” But then I thought that I don't necessarily have to be a human being. I could also be a corpse.","But despite everything, I can't imagine Margo alive here. The thought that Whitman's poem might be a suicide note crosses my mind. I think about the things she underlined: ""To die is different from what anyone supposed, and luckier."" ""I bequeath myself to the dirt to grow from the grass I love, / If you want me again, look for me under your boot-soles."" Thinking about the last line of the poem, I feel a wave of hope for a moment: ""I stop somewhere waiting for you ""you."" But then I think that the word ""I"" does not have to be a person. ""I"" could also be a corpse.","But, even so, I can't imagine her alive here. It occurs to me that the Whitman could be a suicide note. I think of verses she had marked: ""And to die is different from what anyone supposed, and luckier."" ""Let the mud be my inheritance, I want to grow from the grass I love; / If you want to find me, look for me under the soles of your shoes."" For a moment I feel a flash of hope thinking about the last verse of the poem: ""I stop somewhere waiting for you."" But then I think that this first person doesn't have to be a person. It could also be a body."
