line_no,Single_ent,Multiple_ents,en,vi,tr,es,vi_translation,tr_translation,es_translation
403,['margo'],,"The window was a little high for Margo, so I put my hands together and she stepped a socked foot onto my hand and I boosted her up. Her silent entrance into the house would have made a ninja jealous. I proceeded to jump up, get my head and shoulders into the window, and then attempt, via a complicated torso undulation, to dance the caterpillar into the house. That might have worked fine except I racked my balls against the windowsill, which hurt so bad that I groaned, which was a pretty sizable mistake.","Cửa sổ hơi cao so với Margo, nên tôi chắp tay để cô ấy dận một chân đi bít tất lên, và tôi đẩy Margo lên. Cô ấy vào trong êm ái đến mức ninja thứ thiệt chắc cũng phải ghen tị. Tôi nhảy lên, chui được đầu và vai qua cửa sổ, rồi với nỗ lực xoắn vặn cơ thể, tôi uốn éo như sâu lùn chùn bò vào trong. Sự thể lẽ ra đã suôn sẻ, nếu tôi không lỡ cọ hai quả trứng cò vào bậu cửa sổ, đau tê tái đến mức tôi không nén nổi rên rẩm, gây ra một sai lầm vô cùng tệ hại.","Pencere Margo için biraz yüksekti, bu yüzden ellerimi birleştirdim, Margo çoraplı ayağıyla elimin üstüne bastı ve onu yukarı doğru ittim. Sessizce eve girişi bir ninjayı kıskandınrdı. Bense yukan zıplayıp başımı ve omuzlarımı pencereye ulaştırmaya, karmaşık bir vücut dalgalanması yoluyla, tırtıl gibi dans ederek evin içine girmeye çalıştım. Her şey iyi gitmiş olabilirdi, yalnız hayalarım pencere eşiğine takıldı ve acıdan inledim ki bu oldukça büyük bir hataydı.","Como la ventana estaba un poco alta para Margo, junté las manos, puso un pie encima y la impulsé. Su silenciosa entrada en la casa habría sido la envidia de un ninja. Me dispuse a subir, metí la cabeza y los hombros por la ventana, y pretendía, mediante una complicada contorsión, entrar en la casa en plan oruga. Podría haber funcionado perfectamente de no haberme aplastado los huevos contra la repisa, y me dolió tanto que solté un quejido, lo cual suponía un error nada desdeñable.","The window was a bit high for Margo, so I clasped my hands for her to step on with one socked foot, and I pushed Margo up. She got in so smoothly that even a real ninja would be envious. I jumped up, got my head and shoulders through the window, and with a twisting effort, I wriggled like a worm to get inside. Things would have gone smoothly if I hadn't accidentally brushed my two eggs against the window sill, causing such excruciating pain that I couldn't help but groan, leading to a terribly bad mistake.","The window was a bit high for Margo, so I clasped my hands together, Margo stepped on my hand with her socked foot, and I pushed her up. Her silent entry into the house would make a ninja envious. As for me, I tried to jump up and get my head and shoulders to the window, attempting to enter the house by performing a complex body undulation, dancing like a caterpillar. Everything might have gone well, except my groin got caught on the window sill and I groaned in pain, which was quite a big mistake.","Since the window was a bit high for Margo, I cupped my hands, she put a foot on them, and I boosted her up. Her silent entry into the house would have been the envy of a ninja. I prepared to climb up, stuck my head and shoulders through the window, and intended, through a complicated contortion, to enter the house caterpillar-style. It could have worked perfectly if I hadn't crushed my balls against the ledge, and it hurt so much that I let out a groan, which was no small mistake."
404,"['chuck parso', 'chuck parson']",,"A bedside light came on. And there, lying in bed, was some old guy—decidedly not Chuck Parson. His eyes were wide with terror; he didn’t say a thing.",Đèn ở đầu giường bật sáng. Người nằm trên giường là một bác trai có tuổi–rõ ràng không phải Chuck Parson. Bác ta tròn mắt kinh hãi và không nói nổi lời nào.,"Bir başucu lambası yandı. Ve orada, yatakta yatan, yaşlı bir adamdı... açık bir şekilde Chuck Parson değildi. Gözleri dehşetle açılmıştı; hiçbir şey söylemedi.","Se encendió la luz de la mesita. Y resultó que el que estaba en la cama era un viejo, sin duda no era Chuck Parson. Abrió los ojos como platos, aterrorizado. No dijo una palabra.",The bedside lamp turned on. The person lying on the bed was an elderly man—clearly not Chuck Parson. He widened his eyes in horror and couldn't utter a word.,"A bedside lamp turned on. And there, lying in bed, was an old man... it was clearly not Chuck Parson. His eyes were wide with terror; he said nothing.","The light on the bedside table turned on. And it turned out that the one in the bed was an old man, certainly not Chuck Parson. He opened his eyes wide, terrified. He didn't say a word."
407,['margo'],,"“I think we share the blame on that one,” Margo said.","“Vụ vừa rồi cả hai đứa mình đều ấm ớ,” Margo nói.","“Bence bu seferki suçu paylaşıyoruz,” dedi Margo.",—Creo que esta vez la culpa es de los dos —dijo Margo.,"""We both messed up last time,"" Margo said.","""I think we're sharing the blame this time,"" said Margo.",—I think this time it's both of our faults —said Margo.
413,['chuck parson'],,“I need you to use Radar’s login to the student directory and look up an address. Chuck Parson.”,“Tôi cần ông dùng tài khoản của Radar đăng nhập vào danh bạ của trường và tra một địa chỉ. Chuck Parson.,“Radar’m öğrenci sistemine giriş şifresini kullamp bir adrese bakman lazım. Chuck Parson.,—Necesito que entres en la página del instituto con la contraseña de Radar y me busques una dirección. Chuck Parson.,“I need you to use Radar's account to log into the school's directory and look up an address. Chuck Parson.”,"""You need to use Radar's student system login password to check an address."" Chuck Parson.""",—I need you to log into the institute's website with Radar's password and find me an address. Chuck Parson.
418,['chuck parson'],,"“Yeah, yeah, I just did it. I was doing it while saying no—can’t help but help. Four-two-two Amherst. Hey, why do you want Chuck Parson’s address at four-twelve in the morning?”","“Rồi rồi, làm xong rồi đó. Tôi đã làm trong khi nói không rồi đó–không thể làm gì ngoài giúp đỡ há. Bốn-hai-hai Amherst. Này, thế quái nào mà ông lại cần địa chỉ của Chuck Parson vào lúc bốn giờ mười hai phút sáng vậy?”","“Evet evet, az önce yaptım. Hayır derken yapıyordum, yardım etmekten başka çarem yok. 422 Amherst. Hey, sabahın dört buçuğunda neden Chuck Parson’m adresini istiyorsun?","—Sí, sí. Ya está. Estaba entrando mientras te decía que no… No puedo evitar ayudarte. Amherst, 422. Oye, ¿para qué necesitas la dirección de Chuck Parson a las cuatro y doce de la mañana?","“Alright, alright, it's done. I did it while saying no–can't do anything but help, huh. Four-two-two Amherst. Hey, why the heck do you need the address of Chuck Parson at twelve minutes past four in the morning?","“Yes, yes, I just did it. I was doing it while saying no, I have no choice but to help. 422 Amherst. Hey, why are you asking for Chuck Parson’s address at four-thirty in the morning?”","—Yes, yes. It's done. I was coming in while I was telling you no... I can't help but assist you. Amherst, 422. Hey, why do you need Chuck Parson's address at four twelve in the morning?"
425,['margo'],,"Margo glanced at her watch and held up two fingers. We waited. And for those two minutes we just stared at each other, and I watched the blue in her eyes. It was nice—in the dark and the quiet, with no possibility of me saying anything to screw it up, and her eyes looking back, like there was something in me worth seeing.","Margo liếc đồng hồ và giơ hai ngón tay lên. Chúng tôi đợi. Trong hai phút ấy hai đứa chỉ nhìn nhau, và tôi nhìn màu xanh trong mắt cô ấy. Thật tuyệt–trong bóng tối và không gian yên tĩnh, không có nguy cơ tôi sẽ vạ miệng nói lung tung làm hỏng khung cảnh, và đôi mắt cô ấy nhìn lại tôi, như thể có gì đó ở tôi đáng được nhìn vậy.","Margo saatine bir göz attı ve iki parmağını yukarı kaldırdı. Bekledik. O iki dakika boyunca sadece birbirimize gözlerimizi dikip baktık ve ben onun gözlerindeki maviliği izledim. Çok hoştu... karanlık ve sessizlik, her şeyi mahvedecek bir şey söyleme ihtimalim olmadan. Ve onun gözleri de bana bakıyordu, sanki bende görmeye değer bir şey varmış gibi.","Margo echó un vistazo a su reloj y levantó dos dedos. Esperamos. Y durante dos minutos nos quedamos mirándonos. Yo observé el azul de sus ojos. Fue bonito. A oscuras y en silencio, sin la posibilidad de que yo dijera algo y metiera la pata, y ella me devolvía la mirada, como si hubiera algo en mí que merecía la pena ver.","Margo glanced at the clock and raised two fingers. We waited. During those two minutes, we just looked at each other, and I gazed into the blue of her eyes. It was wonderful—in the darkness and quiet space, there was no risk of me saying something foolish to ruin the moment, and her eyes looked back at me, as if there was something in me worth looking at.","Margo glanced at her watch and raised two fingers. We waited. During those two minutes, we just stared into each other's eyes, and I watched the blueness in her eyes. It was very nice... darkness and silence, without the possibility of me saying something that would ruin everything. And her eyes were looking at me too, as if there was something worth seeing in me.","Margo glanced at her watch and raised two fingers. We waited. And for two minutes we just stared at each other. I observed the blue of her eyes. It was beautiful. In the dark and in silence, without the possibility of me saying something and messing it up, and she returned my gaze, as if there was something in me worth seeing."
468,['margo'],,"“You’re just a really loud, awkward ninja,” Margo said, “but we are both ninjas.” She tucked her hair behind her ears, pulled up her hood, and scrunched it shut with a drawstring; the streetlight lit up the sharp features of her pale face. Maybe we were both ninjas, but only she had the outfit.","“Cậu là chàng ninja ồn ào và lắm chuyện,” Margo nói, “nhưng hai đứa mình đều là ninja.” Cô ấy vén tóc ra sau vành tai, đội mũ lên, thít chặt dây rút; ánh sáng từ ngọn đèn đường rọi lên những nét sắc sảo trên khuôn mặt nhợt nhạt của cô ấy. Có thể cả hai đứa tôi đều là ninja, nhưng chỉ Margo mặc trang phục thích hợp.","“Sen sadece gerçekten gürültücü, sakar bir ninjasın,” dedi Margo, “ama ikimiz de ninjayız.” Saçını kulaklarının arkasına attı; kapüşonunu başma çekip ipiyle hışırdatarak büzdü; sokak lambası solgun yüzünün keskin hatlarını aydınlatıyordu. Belki ikimiz de ninjaydık fakat ekipmanı olan yalnızca oydu.","—Los dos somos ninjas, solo que tú eres un ninja torpe y ruidoso —dijo Margo. Se colocó el pelo detrás de las orejas, se puso la capucha y se la ató con el cordón. La farola iluminó los agudos rasgos de su cara pálida. Quizá los dos éramos ninjas, pero solo ella lo parecía.","“You are the noisy and talkative ninja,” Margo said, “but we are both ninjas.” She tucked her hair behind her ear, put on her hat, and tightened the drawstring; the light from the streetlamp illuminated the sharp features on her pale face. Maybe we were both ninjas, but only Margo was dressed appropriately.","“You’re just a really noisy, clumsy ninja,” said Margo, “but we’re both ninjas.” She tucked her hair behind her ears; pulled her hood over her head and tightened it with a rustle; the street lamp illuminated the sharp features of her pale face. Maybe we were both ninjas, but she was the only one with equipment.","—We are both ninjas, only you are a clumsy and noisy ninja —said Margo. She tucked her hair behind her ears, put on the hood, and tied it with the cord. The streetlamp illuminated the sharp features of her pale face. Maybe we were both ninjas, but only she looked like one."
469,['margo'],,"“Okay,” she said. “Memorize the map.” By far the most terrifying part of the half-mile-long journey Margo had plotted for us was the moat. SeaWorld was shaped like a triangle. One side was protected by a road, which Margo figured was regularly patrolled by night watchmen. The second side was guarded by a lake that was at least a mile around, and the third side had a drainage ditch; from the map, it looked to be about as wide as a two-lane road. And where there are water-filled drainage ditches near lakes in Florida, there are often alligators.","“Được rồi,” cô ấy nói. “Ghi nhớ bản đồ nhé.” Đến thời điểm này, phần gian nguy nhất trong hành trình nửa dặm mà Margo đã vạch ra chính là hào nước. Địa hình SeaWorld như một tam giác. Một cạnh là mặt đường, Margo suy luận rằng sẽ thường xuyên có nhân viên an ninh đi tuần tra ban đêm. Cạnh thứ hai sát với một hồ nước chu vi ít nhất một dặm, và cạnh thứ ba tiếp giáp hào thoát nước. Nhìn từ bản đồ, hào nước này rộng cỡ một con đường hai làn. Và ở Florida, ở đâu có hào thoát nước cạnh hồ, ở đó thường có cá sấu.","‘Tamam,” dedi. “Haritayı ezberle.” Margo’nun bizim için kurguladığı yaklaşık bir kilometrelik yolculuğun açık ara farkla en korkutucu bölümü hendekti. SeaWorld üçgen şeklindeydi. Bir tarafı, Margo’nun yürüttüğü tahmine göre, gece bekçilerinin devriye gezdiği bir cadde tarafından korunuyordu, ikinci taraf, çevresi en az bir kilometre olan bir göl tarafından gözetiliyordu ve üçüncü tarafta bir drenaj kanalı vardı; haritada yaklaşık iki şeritli bir yol kadar geniş görünüyordu. Ve Florida’da, göllerin yakınında suyla dolu drenaj kanalları varsa, orada genellikle timsahlar olur.","—Bien —me dijo—, memoriza el mapa. La parte más terrorífica del recorrido de casi un kilómetro que Margo había trazado era, con diferencia, el foso. El SeaWorld tenía forma triangular. Un lado estaba protegido por una carretera por la que Margo suponía que patrullaban permanentemente vigilantes nocturnos. El segundo lado estaba protegido por un lago de casi dos kilómetros de perímetro, y en el tercero había una zanja de drenaje. Según el mapa, parecía tener la anchura de una carretera de dos carriles. Y en Florida, en las zanjas de drenaje junto a los lagos suele haber caimanes.","“Alright,” she said. “Remember the map.” At this point, the most perilous part of the half-mile journey Margo had outlined was the moat. The terrain of SeaWorld was like a triangle. One side was the road, which Margo reasoned would frequently have security personnel patrolling at night. The second side bordered a lake with a circumference of at least a mile, and the third side adjoined a drainage ditch. From the map, this moat appeared to be as wide as a two-lane road. And in Florida, where there is a drainage ditch next to a lake, there are often alligators.","‘Okay,’ he said. ‘Memorize the map.’ The most terrifying part by far of the roughly one-kilometer journey Margo had planned for us was the ditch. SeaWorld was triangular in shape. One side, according to Margo's estimation, was guarded by a street patrolled by night watchmen, the second side was watched over by a lake with a circumference of at least one kilometer, and the third side had a drainage channel; on the map, it appeared to be about two lanes wide. It looked as wide as a road. And in Florida, if there are drainage canals filled with water near the lakes, there are usually alligators there.","—Alright —he told me—, memorize the map. The most terrifying part of the nearly one-kilometer route that Margo had mapped out was, by far, the moat. SeaWorld was triangular in shape. One side was protected by a road on which Margo assumed night watchmen patrolled permanently. The second side was protected by a lake with a perimeter of almost two kilometers, and on the third side, there was a drainage ditch. According to the map, it seemed to be as wide as a two-lane road. And in Florida, drainage ditches next to lakes usually have alligators."
470,['margo'],,"Margo grabbed me by both shoulders and turned me toward her. “We’re going to get caught, probably, and when we do, just let me talk. You just look cute and be that weird mix of innocent and confident, and we’ll be fine.”","Margo đặt cả tay lên hai vai tôi và xoay tôi lại phía cô ấy. “Bọn mình sẽ bị tóm, có thể thôi, trong trường hợp đó, cứ để tớ nói mọi chuyện. Cậu chỉ cần tỏ ra hiền hiền kiểu nửa ngây thơ nửa thẳng thắn, rồi ta sẽ ổn cả thôi.”","Margo beni iki omzumdan tutup kendine çevirdi. “Muhtemelen yakalanacağız ve yakalandığımızda bırak ben konuşayım. Sen sadece şirin görünüp şu tuhaf masumkendinden emin tavrını sergilersen, her şey yolunda gider.","Margo me agarró por los hombros y me giró hacia ella. —Seguramente nos pillarán, así que, cuando nos pillen, déjame hablar a mí. Tú limítate a poner cara de bueno, medio inocente, medio seguro de ti mismo, y todo irá bien.","Margo put both hands on my shoulders and turned me to face her. ""We might get caught, maybe, in that case, just let me do all the talking. You just need to act kind of innocent and straightforward, and we'll be fine.""","Margo grabbed me by both shoulders and turned me towards her. “We will probably get caught, and when we do, let me do the talking. You just need to look cute and display that weirdly innocent yet confident demeanor of yours, and everything will be fine.”","Margo grabbed me by the shoulders and turned me towards her. —Surely they will catch us, so when they do, let me do the talking. You just focus on looking good, half innocent, half confident, and everything will be fine."
472,['margo'],,"We jogged across I-Drive and then started bushwhacking through a thicket of tall shrubs and oak trees. I started to worry about poison ivy, but ninjas don’t worry about poison ivy, so I led the trail, my arms in front of me, pushing aside briars and brush as we walked toward the moat. Finally the trees stopped and the field opened up, and I could see the parkway on our right and the moat straight ahead of us. People could have seen us from the road if there had been any cars, but there weren’t. Together we took off running through the brush, and then made a sharp turn toward the parkway. Margo said, “Now, now!” and I dashed across the six lanes of highway. Even though it was empty, something felt exhilarating and wrong about running across a road that big.","Chúng tôi đi bộ qua I-Drive, bắt đầu mò đường qua đám sồi rậm rạp và cây bụi lùm xùm. Tôi hơi lo về độc tố của cây thường xuân, nhưng ninja không sợ độc tố thường xuân, thế là tôi xông lên, cánh tay giơ trước mặt, gạt cành gai lá lẻo sang hai bên để tiến về phía hào nước. Cuối cùng cũng qua được vạt cây và tầm nhìn thoáng ra, tôi thấy con đường với hàng cây ở bên tay phải và hào nước thẳng phía trước mặt. Ai ngồi trong xe trên đường hẳn sẽ nhìn thấy chúng tôi, nhưng chẳng có chiếc xe nào cả. Chúng tôi cùng chạy qua bụi rậm, rẽ ngoặt về phía hàng cây. Margo nói, “Nào, nào!” và tôi xẹt qua đường cao tốc sáu làn xe. Dù trên đường hoàn toàn không có ma nào, trong tôi vẫn dội lên cơn phấn khích và cảm giác sai trái to đùng khi chạy cắt qua một con đường lớn đến vậy.","1Bulvan’nın öteki tarafına koştuk, sonra uzun çalılar ile meşelerden oluşan yeşilliğin içinde pusuya yattık. Zehirli sarmaşık hakkında endişelenmeye başlamıştım ama ninjalar zehirli sarmaşık hakkında endişelenmeyecekleri için hendeğe doğru yürürken, kollarım önde, dikenli çalılan ve fundalığı kenara iterek öncülük ettim. Nihayet ağaçlar bitti ve meydan ortaya çıktı, böylece sağımdaki bulvarı ve tam karşımızda olan hendeği görebildim. Eğer birkaç araba olsaydı, insanlar yoldan bizi görebilirlerdi ama hiç araba yoktu. Birlikte yeşilliklerin arasından koşmak için harekete geçtik ve sonra bulvara doğru keskin bir dönüş yaptık. Margo, “Şimdi, şimdi!” dedi ve ben fırlayıp anayolun altı şeridini geçtim. Yol boş olduğu halde, bu kadar büyük bir caddeyi koşarak geçmekle ilgili bir şey hem heyecan verici hem de yanlışmış gibi geliyordu.","Corrimos por International Drive y luego nos abrimos camino entre arbustos altos y robles. Empecé a preocuparme por la hiedra venenosa, pero los ninjas no se preocupan por esas cosas, así que me coloqué a la cabeza, con los brazos extendidos, y aparté las zarzas y la maleza mientras avanzábamos hacia el foso. Al final se acabó la zona de árboles y llegamos a campo abierto. Veía la autopista a nuestra derecha y el foso justo enfrente. Podrían habernos visto desde la carretera si hubiera pasado algún coche, pero no pasó ninguno. Corrimos por la maleza y trazamos una curva cerrada hacia la autopista. —¡Ahora! ¡Ahora! —exclamó Margo. Y crucé corriendo los seis carriles de la autopista. Aunque estaba vacía, cruzar una carretera tan grande me pareció estimulante e inapropiado.","We walked through I-Drive, starting to find our way through the dense oaks and tangled bushes. I was a bit worried about the ivy's toxins, but ninjas aren't afraid of ivy toxins, so I charged ahead, arms raised in front of me, pushing the thorny branches aside to move towards the moat. Finally getting through the patch of trees and with a clearer view, I saw the road with rows of trees on the right and the moat straight ahead. Anyone sitting in a car on the road would surely see us, but there were no cars at all. We ran through the bushes together, turning towards the row of trees. Margo said, ""Come on, come on!"" and I darted across the six-lane highway. Even though there wasn't a soul on the road, I still felt a surge of excitement and a huge sense of wrongdoing as I dashed across such a big road.","We ran to the other side of the boulevard, then lay in ambush in the greenery made up of long bushes and oaks. I had started to worry about poison ivy, but since ninjas wouldn't worry about poison ivy, I led the way towards the ditch, arms forward, pushing aside thorny bushes and shrubs. Finally, the trees ended and the clearing emerged, allowing me to see the boulevard to my right and the ditch directly in front of us. If there had been a few cars, people could have seen us from the road, but there were no cars at all. We moved to run through the greenery together and then made a sharp turn towards the boulevard. Margo said, ""Now, now!"" and I dashed across the six lanes of the main road. Even though the road was empty, there was something both thrilling and wrong about running across such a big street.","We ran along International Drive and then made our way through tall bushes and oaks. I started to worry about poison ivy, but ninjas don't worry about those things, so I took the lead, with my arms outstretched, and pushed aside the brambles and weeds as we advanced toward the moat. Eventually, the wooded area ended and we reached an open field. I could see the highway to our right and the moat directly ahead. We could have been seen from the road if any cars had passed by, but none did. We ran through the underbrush and made a sharp turn toward the highway. —Now! Now! —exclaimed Margo. And I ran across the six lanes of the highway. Although it was empty, crossing such a large road seemed thrilling and inappropriate to me."
